{
  "schema_version": "formalization-faithfulness-1",
  "role": "direct-judge",
  "task_id": "HDP-02-REM-2.3.4",
  "source_sha256": "ecc53be86c091b5df118c4464b6d81672e0261df960a3f32ceea4900107d090a",
  "dossier_sha256": "58244a56edf65eb376df9ecc07f966428047658816467b5fb3d9b7258edc5482",
  "dependency_coverage": [
    {
      "id": "D001",
      "name": "And",
      "interpretation": "Logical conjunction of two propositions.",
      "effect_on_target": "Combines the fixed-rate Stirling equivalence with the point-mass/tail/profile sandwich.",
      "source_match": "The source's sharpness discussion jointly uses the point-mass approximation and the upper-tail comparison.",
      "status": "pass"
    },
    {
      "id": "D002",
      "name": "Asymptotics.IsEquivalent",
      "interpretation": "The difference of two real-valued functions is little-o of the comparison function along the stated filter; for the positive fixed-rate profile this is ordinary asymptotic equivalence.",
      "effect_on_target": "Formalizes equation (2.9) as a fixed-rate, large-k equivalence for the point mass only.",
      "source_match": "This is the standard precise reading of the approximation obtained from Stirling's formula and does not assert an asymptotic equivalence for the actual tail.",
      "status": "pass"
    },
    {
      "id": "D003",
      "name": "DivInvMonoid.toDiv",
      "interpretation": "Supplies ordinary division from the real div-inverse structure.",
      "effect_on_target": "Interprets division by k and by the square-root factor in the displayed profile.",
      "source_match": "These are the divisions appearing in the Stirling profile.",
      "status": "pass"
    },
    {
      "id": "D004",
      "name": "Filter.atTop",
      "interpretation": "The filter of eventually true properties as the ordered natural-number index tends upward without bound.",
      "effect_on_target": "Makes the equivalence a statement about k tending to infinity.",
      "source_match": "Stirling's approximation in the remark is a large-k approximation.",
      "status": "pass"
    },
    {
      "id": "D005",
      "name": "HDiv.hDiv",
      "interpretation": "Dispatches heterogeneous division; here it resolves to real division.",
      "effect_on_target": "Builds the factors eλ/k and profile divided by sqrt(2kπ).",
      "source_match": "It preserves the divisions in equation (2.9).",
      "status": "pass"
    },
    {
      "id": "D006",
      "name": "HMul.hMul",
      "interpretation": "Dispatches heterogeneous multiplication; here it resolves to real multiplication.",
      "effect_on_target": "Builds the exponential profile and the radicand 2kπ.",
      "source_match": "It preserves the products in equations (2.8) and (2.9).",
      "status": "pass"
    },
    {
      "id": "D007",
      "name": "HPow.hPow",
      "interpretation": "Dispatches exponentiation; here a real base is raised to a natural exponent.",
      "effect_on_target": "Interprets (e·rate/k)^k.",
      "source_match": "This is exactly the power in both displayed source profiles at integer threshold k.",
      "status": "pass"
    },
    {
      "id": "D008",
      "name": "LE.le",
      "interpretation": "The non-strict order relation supplied by the relevant typeclass, here real ≤.",
      "effect_on_target": "Expresses both sides of the point-mass ≤ actual-tail ≤ Chernoff-profile sandwich and the tail set predicate.",
      "source_match": "The upper inequality has the source's direction, while the lower inequality records that the first atom lies in the tail.",
      "status": "pass"
    },
    {
      "id": "D009",
      "name": "LT.lt",
      "interpretation": "The strict order relation supplied by the relevant typeclass, here real <.",
      "effect_on_target": "Imposes rate < k before the tail sandwich.",
      "source_match": "This is the integer-threshold specialization of the source condition t > λ.",
      "status": "pass"
    },
    {
      "id": "D010",
      "name": "MeasureTheory.Measure.real",
      "interpretation": "Evaluates a measure on a set and converts the resulting extended nonnegative real to a real.",
      "effect_on_target": "Represents the actual Poisson probability of the upper-tail set.",
      "source_match": "For the probability measure involved, this is the real-valued probability P{X ≥ k}, with no infinite-mass truncation issue.",
      "status": "pass"
    },
    {
      "id": "D011",
      "name": "Monoid.toNatPow",
      "interpretation": "Provides natural-number powers from the real multiplicative monoid.",
      "effect_on_target": "Makes the exponent k in (e·rate/k)^k a natural power.",
      "source_match": "The source's k is an integer support value and exponent.",
      "status": "pass"
    },
    {
      "id": "D012",
      "name": "NNReal",
      "interpretation": "The subtype of real numbers satisfying 0 ≤ rate.",
      "effect_on_target": "Quantifies the theorem over nonnegative Poisson rates, including the degenerate zero-rate law.",
      "source_match": "It matches the usual Poisson parameter domain in the intended positive-rate regime and conservatively includes rate zero, whose endpoint convention is not settled by the selected passage.",
      "status": "pass"
    },
    {
      "id": "D013",
      "name": "NNReal.toReal",
      "interpretation": "Returns the underlying real value of a nonnegative real.",
      "effect_on_target": "Places the rate in real exponentials, inequalities, products, and quotients.",
      "source_match": "This is the scalar λ used in the source formulas.",
      "status": "pass"
    },
    {
      "id": "D014",
      "name": "Nat",
      "interpretation": "The natural numbers.",
      "effect_on_target": "Types the Poisson support indices k and n.",
      "source_match": "Poisson atoms and the factorial/Stirling formula are indexed by nonnegative integers.",
      "status": "pass"
    },
    {
      "id": "D015",
      "name": "Nat.cast",
      "interpretation": "Casts a natural number into the target numeric type, here Real.",
      "effect_on_target": "Allows k and n to participate in real inequalities and the analytic profile.",
      "source_match": "It implements the ordinary identification of integer support values with real thresholds.",
      "status": "pass"
    },
    {
      "id": "D016",
      "name": "Nat.instAtLeastTwoHAddOfNat",
      "interpretation": "Provides typeclass evidence that the constructed natural numeral 2 is at least two.",
      "effect_on_target": "Supports elaboration of the real numeral 2 in sqrt(2kπ).",
      "source_match": "It has no independent mathematical effect and preserves the source coefficient 2.",
      "status": "pass"
    },
    {
      "id": "D017",
      "name": "Nat.instMeasurableSpace",
      "interpretation": "The complete discrete measurable space on Nat.",
      "effect_on_target": "Makes the upper-tail subset of the Poisson support measurable.",
      "source_match": "This is appropriate for probabilities of events of a discrete natural-valued random variable.",
      "status": "pass"
    },
    {
      "id": "D018",
      "name": "Nat.instNeZeroSucc",
      "interpretation": "Supplies nonzero evidence for a natural successor.",
      "effect_on_target": "Supports elaboration of the numeral 2 used in the radicand.",
      "source_match": "It is elaboration infrastructure with no change to the source formula.",
      "status": "pass"
    },
    {
      "id": "D019",
      "name": "Nat.instPreorder",
      "interpretation": "The standard preorder on natural numbers.",
      "effect_on_target": "Determines the meaning of atTop as k grows through Nat.",
      "source_match": "It gives the intended large-integer regime for Stirling's formula.",
      "status": "pass"
    },
    {
      "id": "D020",
      "name": "Neg.neg",
      "interpretation": "Unary negation, here real negation.",
      "effect_on_target": "Forms -rate in exp(-rate).",
      "source_match": "It preserves the factor e^{-λ}.",
      "status": "pass"
    },
    {
      "id": "D021",
      "name": "NonUnitalSeminormedCommRing.toNonUnitalSeminormedRing",
      "interpretation": "Projects the nonunital seminormed-ring structure required by inherited real analytic structure.",
      "effect_on_target": "Contributes only to the typeclass chain used by real-valued asymptotic equivalence.",
      "source_match": "It leaves the standard real norm and arithmetic unchanged.",
      "status": "pass"
    },
    {
      "id": "D022",
      "name": "NonUnitalSeminormedRing.toSeminormedAddCommGroup",
      "interpretation": "Obtains the seminormed additive commutative group used by IsEquivalent.",
      "effect_on_target": "Makes asymptotic comparison use the ordinary real additive difference and norm.",
      "source_match": "This is the appropriate analytic structure for a real-valued Stirling equivalence.",
      "status": "pass"
    },
    {
      "id": "D023",
      "name": "NormedCommRing.toSeminormedCommRing",
      "interpretation": "Projects the standard real normed commutative ring to a seminormed commutative ring.",
      "effect_on_target": "Supports the real seminormed structure used in the asymptotic predicate.",
      "source_match": "It introduces no nonstandard interpretation of the source quantities.",
      "status": "pass"
    },
    {
      "id": "D024",
      "name": "OfNat.ofNat",
      "interpretation": "Interprets natural-number literals in a target type.",
      "effect_on_target": "Interprets the real constants 1 and 2 and supporting natural literals.",
      "source_match": "The resulting constants match e^1 and sqrt(2πk).",
      "status": "pass"
    },
    {
      "id": "D025",
      "name": "One.toOfNat1",
      "interpretation": "Provides the numeral-one interpretation from a One instance.",
      "effect_on_target": "Interprets the exponent argument 1 in exp(1).",
      "source_match": "exp(1) is the source's constant e.",